{
 "schemaVersion": 1,
 "id": "thac0",
 "sourceRuleID": "phb_ch09_calculating_thac0",
 "note": "index 0 = level 1",
 "groups": {
  "Priest": [
   20,
   20,
   20,
   18,
   18,
   18,
   16,
   16,
   16,
   14,
   14,
   14,
   12,
   12,
   12,
   10,
   10,
   10,
   8,
   8
  ],
  "Rogue": [
   20,
   20,
   19,
   19,
   18,
   18,
   17,
   17,
   16,
   16,
   15,
   15,
   14,
   14,
   13,
   13,
   12,
   12,
   11,
   11
  ],
  "Warrior": [
   20,
   19,
   18,
   17,
   16,
   15,
   14,
   13,
   12,
   11,
   10,
   9,
   8,
   7,
   6,
   5,
   4,
   3,
   2,
   1
  ],
  "Wizard": [
   20,
   20,
   20,
   19,
   19,
   19,
   18,
   18,
   18,
   17,
   17,
   17,
   16,
   16,
   16,
   15,
   15,
   15,
   14,
   14
  ]
 }
}